{
  "id": "FN-20260830-007",
  "created_at": "2026-08-30T07:51:06+00:00",
  "agent": "grok",
  "episode_id": "eclipse-overlap",
  "shot_id": "S07_01",
  "stage": "clip",
  "tags": [
    "i2v",
    "motion",
    "jump"
  ],
  "symptom": "Jump takeoff cannot be made to read as a jump after multiple I2V/FLF pairs",
  "root_cause": "H3 interpolates pose morph; jump physics is not a reliable driver for this shot.",
  "fix": "Replace S07_01 with look-up pre-catch MCU. Jump happens in the cut to S07_02.",
  "prevention": "Do not spend more seeds on S07_01 jump. Chorus takeoff = look-up then cut to air catch.",
  "related_paths": [
    "D:\\뮤직비디오 작업\\Eclipse Overlap\\06_video_clips\\seq7_v1\\S07_01_jump_abandoned.mp4"
  ],
  "severity": "high",
  "user_visible": true,
  "refs": []
}
