{
  "id": "FN-20260908-003",
  "created_at": "2026-09-08T13:11:55+00:00",
  "agent": "grok",
  "episode_id": "slow_drip",
  "shot_id": "S25",
  "stage": "keyframe",
  "tags": [
    "krea2",
    "identity_edit",
    "aspect"
  ],
  "symptom": "identity_edit output 1024x1024 instead of 1920x1088",
  "root_cause": "generate_krea2_identity_edit defaults aspect=1:1 Square megapixels=1.0",
  "fix": "Do not use identity_edit for 16:9 MV keyframes without --aspect-ratio 16:9 and --megapixels 2. Prefer T2I 1920x1088.",
  "prevention": "For production keyframes use generate_krea.py --width 1920 --height 1088. Identity edit only with explicit landscape aspect.",
  "related_paths": [
    "D:\\뮤직비디오 작업\\[적합] Slow Drip\\05_keyframes\\S25.png"
  ],
  "severity": "high",
  "user_visible": true,
  "refs": []
}
