{
  "id": "FN-20260829-001",
  "created_at": "2026-08-29T23:14:35+00:00",
  "agent": "grok",
  "episode_id": "eclipse_overlap",
  "shot_id": "S01_05",
  "stage": "clip",
  "tags": [
    "extra_hands",
    "extra_limbs",
    "flf",
    "minimax_h3"
  ],
  "symptom": "S01_05 FLF mid-frames grew helper arms from off-screen; jersey 11 became 1; start/end recovered identity",
  "root_cause": "Motion prompt 'tugs wrist tape' read as a second person wrapping tape. Same first=last FLF does not lock the mid",
  "fix": "Prompt: only one athlete, only two hands already shown, fingers press existing tape a few millimeters, no helper, no extra arms. New seed. Visual QA every 25 percent",
  "prevention": "Tape/hand CU: never say tug/wrap/tie as if another person. Count hands at t25 and t50 before pass. Do not trust start=end FLF as mid-lock.",
  "related_paths": [
    "D:\\뮤직비디오 작업\\Eclipse Overlap\\06_video_clips\\seq1_v1\\S01_05_id_pass_limbs_fail.mp4"
  ],
  "severity": "high",
  "user_visible": true,
  "refs": []
}
