{
  "id": "FN-20260830-008",
  "created_at": "2026-08-30T13:28:01+00:00",
  "agent": "unknown",
  "episode_id": null,
  "shot_id": null,
  "stage": "keyframe",
  "tags": [
    "illustrious_advanced",
    "style_drift",
    "lora"
  ],
  "symptom": "Advanced_V37 ignored prompts; 6/6 locks = cyberpunk schoolgirl fire Tokyo skyline",
  "root_cause": "LoraManager node stays on graph and can override checkpoint; saver also writes JSON to -o instead of PNG when dest has Korean path",
  "fix": "Use generate_illustrious_standard or generate_anima; harvest PNG from Comfy output; ASCII staging path",
  "prevention": "QC open first lock still before batch. Never batch Advanced_V37 without visual check. ASCII -o dest.",
  "related_paths": [
    "D:/뮤직비디오 작업/Hydroplaning/05_keyframes/characters"
  ],
  "severity": "high",
  "user_visible": true,
  "refs": []
}
