{
  "id": "FN-20260919-002",
  "created_at": "2026-09-19T09:15:19+00:00",
  "agent": "antigravity",
  "episode_id": "20260923",
  "shot_id": "S07",
  "stage": "clip",
  "tags": [
    "h3",
    "r2v",
    "camera_roll",
    "composition",
    "rejection"
  ],
  "symptom": "scene_07_h3_take01 exhibited severe 35-degree camera roll and diagonal horizon tilt, breaking ambient stillness",
  "root_cause": "Blender plate used an orbital arc camera with rolling perspective; H3 faithfully followed the rolling arc, creating an aggressive diagonal composition unsuitable for an ambient playlist",
  "fix": "Rebuilt Blender scene 07 with perfectly level camera (roll=0, tilt=0, yaw=0), centered celestial sphere, barely perceptible straight push-in only, and updated prompt forbidding all roll/orbit",
  "prevention": "For ambient playlist projects, enforce strict roll=0 lock on all cosmic/space shots; verify horizontal levelness in plate QA before H3 generation",
  "related_paths": [
    "D:\\플레이리스트\\20260923\\work\\clips\\scene_07_h3_take01.mp4"
  ],
  "severity": "high",
  "user_visible": true,
  "refs": []
}
