{
  "id": "FN-20260830-002",
  "created_at": "2026-08-30T00:31:59+00:00",
  "agent": "grok",
  "episode_id": "eclipse_overlap",
  "shot_id": "S04_06",
  "stage": "clip",
  "tags": [
    "dunk",
    "rim_grab",
    "layup",
    "minimax_h3"
  ],
  "symptom": "S04_06 chorus-1 layup I2V became a rim-hang dunk by t50/t99. Hand grabbed the hoop.",
  "root_cause": "Prompt 'tracking with the layup' plus 'ball kisses glass' let H3 complete the scoring action as a dunk. Start still is already airborne near the rim.",
  "fix": "Lock body in finger-roll pose. Ball banks off glass. Explicit: shooting hand stays below the rim, never grabs, no hanging. Prefer locked tripod so he does not fly into the hoop.",
  "prevention": "Chorus-1 S04_06: never say dunk, hang, rim grab, or tracking into the hoop. QA t50/t99 hand-rim gap. Last dunk only at S07_03.",
  "related_paths": [
    "D:\\뮤직비디오 작업\\Eclipse Overlap\\06_video_clips\\seq4_v1\\S04_06_dunk_fail.mp4"
  ],
  "severity": "high",
  "user_visible": true,
  "refs": []
}
