{
  "id": "FN-20260902-006",
  "created_at": "2026-09-02T23:07:51+00:00",
  "agent": "unknown",
  "episode_id": "monday_overdraft",
  "shot_id": "S12",
  "stage": "keyframe",
  "tags": [
    "krea2",
    "s12",
    "t2i"
  ],
  "symptom": "T2I invented a printer, gibberish card text 데와단라CO, recast face, high angle, card not in slot",
  "root_cause": "S12 generated from still paragraph alone; ignored chem_card_pos composition lock and pos_desk_v1",
  "fix": "identity-edit from chem_card_pos, one change (sleeve roll), face ref master_front, 16:9 2.0MP",
  "prevention": "Hero motif shots: start from locked chemistry plate. Do not T2I S12 from prompt only.",
  "related_paths": [
    "D:\\뮤직비디오 작업\\[적합] 금융치료 (Monday Overdraft)\\05_keyframes\\unit1\\S12\\S12_v1.png"
  ],
  "severity": "high",
  "user_visible": true,
  "refs": []
}
