{
  "id": "FN-20260715-005",
  "created_at": "2026-07-15T14:49:16+00:00",
  "agent": "grok",
  "episode_id": "sonagi_mv_v1",
  "shot_id": null,
  "stage": "planning",
  "tags": [
    "mass_approve",
    "qa_skipped"
  ],
  "symptom": "User required self keyframe/clip verification but agent mass-approved without opening assets.",
  "root_cause": "Treated file existence and CLI ok as approval; no QA_LOG discipline.",
  "fix": "Rule 7.3 + image_cut_verification_gate; QA_LOG required.",
  "prevention": "Never batch-set keyframe_status=approved; open each file; log PASS/FAIL; failure_note on FAIL.",
  "related_paths": [],
  "severity": "critical",
  "user_visible": true,
  "refs": []
}
